GOOG/NASDAQ_AAPL,Apple Inc. (AAPL),12/12/80,12/5/14,daily,12/8/14GOOG/NASDAQ_FB,Facebook Inc (FB),5/17/12,12/5/14,daily,12/8/14GOOG/NASDAQ_TSLA,Tesla Motors Inc (TSLA),6/29/10,12/5/14,daily,12/8/14GOOG/NASDAQ_MSFT,Microsoft Corporation (MSFT),3/13/86,12/5/14,daily,12/8/14GOOG/PINK_MTCH,Matech Corp. (MTCH),11/9/06,1/6/14,daily,4/6/14GOOG/NASDAQ_ZIGO,Zygo Corporation (ZIGO),12/13/83,6/19/14,daily,9/17/14GOOG/PINK_GORXQ,"GeoPharma, Inc. (GORXQ)",1/2/03,12/18/13,daily,3/18/14GOOG/PINK_IPUR,"Innova Pure Water, Inc. (IPUR)",1/2/03,12/4/13,daily,3/4/14GOOG/PINK_SNDTF,Sand Technology Inc. ( USA ) (SNDTF),1/2/03,11/15/13,daily,2/13/14GOOG/PINK_CBTEQ,"Commonwealth Biotechnologies, Inc. (CBTEQ)",1/2/03,9/26/13,daily,9/11/13GOOG/PINK_BYCX,"Bayou City Exploration, Inc. (BYCX)",6/22/05,3/10/14,daily,6/8/14GOOG/PINK_GNTAQ,Genta Incorporated (GNTAQ),3/15/13,8/29/13,daily,11/27/13GOOG/PINK_MIVI,MIV Therapeutics Inc. (MIVI),1/2/03,12/18/13,daily,3/18/14GOOG/NASDAQ_XTXI,Crosstex Energy Inc (XTXI),1/13/04,3/7/14,daily,6/5/14GOOG/NASDAQ_TWTC,TW Telecom Inc (TWTC),5/12/99,10/31/14,daily,12/8/14GOOG/NASDAQ_ARBA,"Ariba, Inc. (ARBA)",6/23/99,10/1/12,daily,12/10/13GOOG/NASDAQ_ALTH,"Allos Therapeutics, Inc. (ALTH)",3/28/00,9/5/12,daily,12/10/13GOOG/NASDAQ_NFSB,"Newport Bancorp, Inc. (NFSB)",7/7/06,9/6/13,daily,12/10/13GOOG/PINK_BUTLQ,"Butler International, Inc (BUTLQ)",1/2/03,10/23/13,daily,1/21/14GOOG/PINK_WTRO,"Wi-Tron, Inc. (WTRO)",5/21/09,9/6/13,daily,12/5/13GOOG/NASDAQ_PURE,PURE Bioscience (PURE),8/8/96,5/16/13,daily,10/15/13GOOG/NASDAQ_BMTI,"BioMimetic Therapeutics, Inc. (BMTI)",5/12/06,2/28/13,daily,12/10/13GOOG/NASDAQ_MPAC,MOD-PAC CORP. (MPAC),3/14/03,9/30/13,daily,12/27/13GOOG/NASDAQ_MOLX,Molex Incorporated (MOLX),3/11/81,12/6/13,daily,3/6/14GOOG/NYSE_MUSA,Murphy USA Inc (MUSA),4/9/10,4/12/13,daily,12/10/13GOOG/NASDAQ_ANLY,Analysts International Corporation (ANLY),3/11/81,10/11/13,daily,1/9/14GOOG/PINK_PSBG,PSB Group Inc (PSBG),6/3/03,3/13/14,daily,6/11/14GOOG/PINK_YTBLA,Ytb Intl Inc Cl A (YTBLA),8/1/07,7/7/14,daily,10/5/14GOOG/NASDAQ_CPTS,"Conceptus, Inc. (CPTS)",2/1/96,6/5/13,daily,12/10/13GOOG/NYSE_BRY,Berry Petroleum Company (BRY),7/1/87,12/16/13,daily,3/16/14GOOG/PINK_OLOU,Omnialuo Inc. (OLOU),1/10/08,11/26/12,daily,8/27/13GOOG/PINK_FTBK,Frontier Financial Corporation (FTBK),1/2/03,1/28/14,daily,4/28/14GOOG/PINK_CASA,"Mexican Restaurants, Inc. (CASA)",1/2/03,5/6/14,daily,8/5/14GOOG/PINK_CHBT,China-Biotics Inc. (CHBT),4/6/06,11/1/13,daily,1/30/14GOOG/NASDAQ_DLGC,Dialogic Inc (DLGC),4/5/07,4/16/13,daily,10/15/13GOOG/NASDAQ_FMFC,First M &amp; F Corporation (FMFC),9/12/96,8/30/13,daily,12/10/13GOOG/NASDAQ_FCFC,FirstCity Financial Corporation (FCFC),11/3/95,5/17/13,daily,12/10/13GOOG/NASDAQ_CBEY,"Cbeyond, Inc. (CBEY)",11/2/05,7/18/14,daily,10/16/14GOOG/NYSE_NGT,Eastern American Natural Gas Trust (NGT),3/9/93,5/24/13,daily,12/10/13GOOG/PINK_ENBP,ENB Financial Corp. (ENBP),1/5/99,3/4/13,daily,8/27/13GOOG/NASDAQ_ATMI,ATMI Inc (ATMI),11/23/93,4/29/14,daily,7/28/14GOOG/NASDAQ_MCBI,"MetroCorp Bancshares, Inc. (MCBI)",12/16/98,1/17/14,daily,4/17/14GOOG/PINK_GWIR,Gate To Wire Solutns (GWIR),7/22/10,10/22/12,daily,8/27/13GOOG/NASDAQ_NINE,Ninetowns Internet Technlgy Grp Co Ltd. (NINE),12/3/04,5/29/14,daily,8/27/14GOOG/NASDAQ_KSWS,K Swiss Inc (KSWS),6/5/90,4/30/13,daily,12/10/13GOOG/NASDAQ_TWGP,"Tower Group International, Ltd. (TWGP)",3/14/13,9/12/14,daily,12/7/14GOOG/PINK_SWRF,SWORDFISH FINANCIAL (SWRF),1/3/11,7/13/11,daily,8/27/13GOOG/PINK_PLKH,ProLink Holdings Corp. (PLKH),1/26/06,9/17/13,daily,12/13/13GOOG/PINK_AMIEQ,AMBASSADORS INTL INC (AMIEQ),1/2/03,10/24/14,daily,12/7/14GOOG/PINK_NDAC,New Dragon Asia Corp. (NDAC),6/8/11,10/31/14,daily,12/8/14GOOG/NASDAQ_BMC,"BMC Software, Inc. (BMC)",10/26/09,9/10/13,daily,12/10/13GOOG/PINK_BVTI,Biovest Intl Inc (BVTI),8/15/05,7/9/13,daily,10/7/13GOOG/PINK_FPBI,"FPB Bancorp, Inc. (FPBI)",7/21/05,7/7/14,daily,10/5/14GOOG/PINK_VLYF,"Valley Forge Composite Technologies, Inc (VLYF)",7/20/07,6/12/14,daily,9/10/14GOOG/NASDAQ_KYAK,Kayak Software Corp (KYAK),7/20/12,5/20/13,daily,12/10/13GOOG/PINK_SPLT,"SpatiaLight, Inc. (SPLT)",8/24/07,7/1/14,daily,9/29/14GOOG/AMEX_SIHI,Sinohub Inc (SIHI),6/11/12,7/1/13,monthly,1/8/14GOOG/NYSE_HTSI,Harris Teeter Supermarkets Inc (HTSI),1/2/03,1/28/14,daily,4/28/14GOOG/PINK_AORE,American Overseas Group Ltd (AORE),12/16/11,12/16/11,daily,8/27/13GOOG/PINK_ENSL,Entech Solar Inc (ENSL),1/2/03,10/21/14,daily,12/8/14GOOG/NYSE_SVN,7 DAYS GROUP HOLDINGS LIMITED(ADR) (SVN),11/20/09,7/5/13,daily,12/10/13GOOG/NYSE_EPL,EPL Oil &amp; Gas Inc (EPL),11/2/00,6/3/14,daily,9/1/14GOOG/NYSE_BNNY,Annies Inc (BNNY),3/28/12,10/20/14,daily,12/8/14GOOG/NASDAQ_HITK,Hi-Tech Pharmacal Co. (HITK),8/3/92,4/16/14,daily,7/15/14GOOG/PINK_FLIP,"FTS Group, Inc. (FLIP)",1/2/03,5/21/13,daily,8/27/13GOOG/NYSE_PSE,Pioneer Southwest Energy Partners L.P. (PSE),5/1/08,12/17/13,daily,3/16/14GOOG/NASDAQ_CRTX,"Cornerstone Therapeutics, Inc. (CRTX)",5/27/04,2/3/14,daily,5/4/14GOOG/NASDAQ_TSTC,Telestone Technologies Corporation (TSTC),7/25/02,4/16/13,daily,10/16/13GOOG/PINK_FFEDQ,Firstfed Fin Cp (FFEDQ),1/2/03,12/28/12,daily,8/27/13GOOG/NASDAQ_OPTR,"Optimer Pharmaceuticals, Inc. (OPTR)",2/9/07,10/23/13,daily,1/21/14GOOG/NYSE_SHAW,Shaw Group Inc. (SHAW),1/2/03,2/12/13,daily,8/27/13GOOG/PINK_ARTD,"ARTISTdirect, Inc. (ARTD)",5/8/03,1/28/14,daily,4/28/14GOOG/NYSE_WRC,Warnaco Group Inc (WRC),2/5/03,2/13/13,daily,8/27/13GOOG/NASDAQ_LCAV,LCA-Vision Inc. (LCAV),1/25/96,5/12/14,daily,8/10/14GOOG/PINK_BMTL,BioMedical Technology Solutns Hldgs Inc. (BMTL),1/2/03,8/6/14,daily,11/4/14GOOG/NASDAQ_HLYS,"Heelys, Inc. (HLYS)",12/8/06,1/24/13,daily,12/10/13GOOG/NASDAQ_SUSS,Susser Holdings Corp. (SUSS),10/19/06,8/28/14,daily,11/26/14GOOG/PINK_ESWW,Environmental Solutions Worldwide Inc. (ESWW),1/2/03,1/22/14,daily,4/22/14GOOG/PINK_ABCW,Anchor BanCorp Wisconsin Inc. (ABCW),1/2/03,9/27/13,daily,12/29/13GOOG/PINK_VULC,Vulcan International Corporation (VULC),1/4/99,11/5/14,daily,12/8/14GOOG/NASDAQ_PNSN,Penson Worldwide (PNSN),6/11/12,8/16/13,weekly,1/8/14GOOG/NASDAQ_ARTC,ArthroCare Corporation (ARTC),2/5/96,5/29/14,daily,8/27/14GOOG/PINK_IFSG,"Infosmart Group, Inc. (IFSG)",10/18/06,7/9/14,daily,10/7/14GOOG/PINK_WBNK,"Waccamaw Bankshares, Inc. (WBNK)",3/24/03,11/5/14,daily,12/8/14GOOG/NASDAQ_VSBN,"VSB Bancorp, Inc. (VSBN)",1/3/00,11/7/14,daily,12/8/14GOOG/NYSE_DUF,Duff &amp; Phelps Corp (DUF),9/28/07,4/22/13,daily,12/10/13GOOG/NASDAQ_HZNP,Horizon Pharma Inc (HZNP),7/28/11,9/19/14,daily,12/8/14GOOG/PINK_DVID,Digital Video Systems Inc. (DVID),1/4/99,12/31/12,daily,8/27/13GOOG/PINK_HLCSQ,Helicos BioSciences Corp. (HLCSQ),5/24/07,3/28/14,daily,6/26/14GOOG/NASDAQ_MFLR,Mayflower Bancorp Inc. (MFLR),12/23/87,11/15/13,daily,2/13/14GOOG/PINK_TBUSQ,Dri Corp. (TBUSQ),1/2/03,1/23/13,daily,8/27/13GOOG/PINK_LPTC,Le@p Technology Inc (LPTC),1/2/03,9/19/13,daily,12/13/13GOOG/NASDAQ_CCCL,China Ceramics Co Ltd (CCCL),11/3/10,4/30/14,daily,7/29/14GOOG/PINK_RKTI,Rocketinfo Inc. (RKTI),8/24/04,8/27/13,daily,11/25/13GOOG/NASDAQ_ULGX,Urologix Inc (ULGX),5/30/96,6/6/13,daily,10/16/13GOOG/PINK_ASCBQ,"Ascendia Brands, Inc. (ASCBQ)",1/7/00,1/23/14,daily,4/23/14GOOG/PINK_SOIGF,Strata Oil &amp; Gas Inc. (SOIGF),7/18/00,10/10/12,daily,8/27/13GOOG/NYSE_SFD,"Smithfield Foods, Inc. (SFD)",3/11/81,9/26/13,daily,12/13/13GOOG/PINK_IBTGF,INTL BARRIER TECH (IBTGF),6/27/12,9/25/12,daily,8/27/13GOOG/PINK_WRSPQ,"Worldspace, Inc. (WRSPQ)",8/4/05,5/7/14,daily,8/5/14GOOG/NYSE_LDK,"LDK Solar Co., Ltd (ADR) (LDK)",6/1/07,2/21/14,daily,5/22/14GOOG/NASDAQ_LNET,Lodgenet Interactive Corp. (LNET),5/28/97,4/1/13,daily,8/27/13GOOG/NASDAQ_CHEV,Cheviot Financial Corp. (CHEV),1/6/04,1/17/12,daily,12/10/13GOOG/PINK_MCAM,Money Centers of America Inc(NDA) (MCAM),10/1/02,11/7/14,daily,12/8/14GOOG/PINK_VBDG,Vertical Branding Inc (VBDG),11/17/06,2/21/14,daily,5/22/14GOOG/NASDAQ_ACOM,Ancestry.com Inc (ACOM),11/5/09,12/28/12,daily,12/10/13GOOG/PINK_AGNM,Acrongenomics Inc. (AGNM),3/5/04,3/27/14,daily,6/25/14GOOG/NASDAQ_NOVB,North Valley Bancorp (NOVB),4/7/98,10/3/14,daily,12/8/14GOOG/PINK_VCMP,VCampus Corporation (VCMP),1/4/99,1/30/14,daily,4/30/14GOOG/PINK_ATCV,ATC Venture Group Inc (ATCV),2/6/02,12/14/12,daily,8/27/13GOOG/PINK_ARINA,Arista Investors Corp. (ARINA),9/27/02,6/17/13,daily,9/11/13GOOG/PINK_TBHS,The Bank Holdings (TBHS),3/23/04,6/30/14,daily,9/30/14GOOG/AMEX_NLP,NTS Realty Holdings LP (NLP),12/29/04,6/10/14,daily,9/8/14GOOG/PINK_AGCI,Angelciti Entertmnt (AGCI),8/27/04,6/28/12,daily,8/27/13GOOG/NYSE_SCR,Simcere Pharmaceutical Group (ADR) (SCR),4/20/07,12/23/13,daily,3/23/14GOOG/NASDAQ_STEL,Stellarone Corp (STEL),1/5/00,12/31/13,daily,3/31/14GOOG/NYSE_SKS,Saks Inc (SKS),6/3/87,11/4/13,daily,2/2/14GOOG/PINK_FSTW,"Firstwave Technologies, Inc. (FSTW)",1/4/99,11/14/13,daily,2/12/14GOOG/PINK_PSPF,Power Sports Factory Inc (PSPF),10/5/04,5/14/13,daily,8/27/13GOOG/PINK_GMEI,Gambit Energy Inc (GMEI),1/20/04,8/14/14,daily,11/12/14GOOG/NASDAQ_FSIN,"Fushi Copperweld, Inc. (FSIN)",9/29/05,12/26/12,daily,12/10/13GOOG/PINK_AONEQ,"A123 Systems, Inc. (AONEQ)",3/15/13,7/8/13,daily,10/6/13GOOG/NYSE_LCC,US Airways Group Inc (LCC),1/2/03,12/6/13,daily,3/6/14GOOG/PINK_DPRS,DEFAULT PROOF CREDIT CARD (DPRS),3/27/07,7/16/13,daily,10/14/13GOOG/PINK_PHOT,Growlife Inc (PHOT),3/23/11,4/9/14,daily,7/8/14GOOG/AMEX_NEWN,New Energy Systems Group. (NEWN),8/16/10,4/16/13,daily,12/10/13GOOG/PINK_SOSO,Storage Computer Corporation (SOSO),1/3/05,1/2/14,daily,4/2/14GOOG/PINK_VISRF,Visiphor Corporation (VISRF),1/3/06,5/22/13,daily,8/27/13GOOG/NASDAQ_FFCO,Fedfirst Financial Corp (FFCO),4/7/05,10/31/14,daily,12/7/14GOOG/NASDAQ_BCSB,BCSB Bancorp Inc (BCSB),7/8/98,2/13/14,daily,5/13/14GOOG/PINK_WSCC,Waterside Capital Corp. (WSCC),1/2/03,1/6/14,daily,4/6/14GOOG/PINK_DPAT,Dental Patient Care America Inc (DPAT),8/25/04,7/25/13,daily,10/22/13GOOG/NYSE_TMS,TMS International Corp. (TMS),11/3/99,10/16/13,daily,1/14/14GOOG/PINK_CABLF,China Cablecom Holdings Ltd. (CABLF),6/26/06,2/10/14,daily,5/12/14GOOG/NYSE_ART,Artio Global Investors Inc. (ART),9/24/09,5/21/13,daily,12/10/13GOOG/NASDAQ_JRCC,James River Coal Company (JRCC),11/16/04,4/16/14,daily,7/15/14GOOG/PINK_SCLR,SCOLR Pharma Inc. (SCLR),1/2/03,7/14/14,daily,10/12/14GOOG/PINK_RMMI,Rocky Mountain Minerals Inc (RMMI),1/2/03,3/18/14,daily,6/16/14GOOG/AMEX_BTC,Community Bankers Trust Corp. (BTC),9/5/06,3/13/13,daily,12/10/13GOOG/PINK_CBCRQ,Capitol Bancorp Ltd. (CBCRQ),1/2/03,2/5/14,daily,5/6/14GOOG/PINK_WAVE,Nextwave Wirless (WAVE),1/3/07,1/24/13,daily,8/27/13GOOG/PINK_HVLL,"Hartville Group, Inc. (HVLL)",11/21/07,7/2/13,daily,9/30/13GOOG/AMEX_BRD,Brigus Gold Corp (USA) (BRD),8/22/08,3/4/14,daily,6/2/14GOOG/PINK_AVZAQ,Aviza Technology In (AVZAQ),1/2/03,3/1/13,daily,8/27/13GOOG/NYSE_ODP,Office Depot Inc (ODP),6/1/88,9/25/14,daily,12/7/14GOOG/NYSE_DOX,Amdocs Limited (DOX),6/19/98,12/19/13,daily,3/19/14GOOG/NASDAQ_QCOR,Questcor Pharmaceuticals Inc (QCOR),11/3/92,8/14/14,daily,11/12/14GOOG/AMEX_AIM,Aerosonic Corporation (AIM),3/11/81,6/10/13,daily,12/10/13GOOG/AMEX_KBX,"Kimber Resources, Inc (USA) (KBX)",12/22/05,1/13/14,daily,4/13/14GOOG/NASDAQ_TRIT,"Tri-Tech Holding, Inc. (TRIT)",9/10/09,12/12/13,daily,3/12/14GOOG/NASDAQ_XOMA,XOMA Corp (XOMA),6/6/86,12/30/11,daily,12/10/13GOOG/NYSE_LVB,Steinway Musical Instruments Inc (LVB),8/2/96,9/18/13,daily,12/13/13GOOG/NASDAQ_SPCHA,"Sport Chalet, Inc. (SPCHA)",9/30/05,8/19/14,daily,11/17/14GOOG/NASDAQ_VITC,"Vitacost.com, Inc. (VITC)",9/24/09,8/15/14,daily,11/13/14GOOG/PINK_OART,The Ohio Art Company (OART),8/25/04,10/31/14,daily,12/8/14GOOG/NASDAQ_GNOM,"Complete Genomics, Inc. (GNOM)",11/11/10,3/18/13,daily,12/10/13GOOG/PINK_IMMCQ,Immunicon Corp. (IMMCQ),8/12/08,7/24/14,daily,10/22/14GOOG/PINK_FCBN,"First Citizens Bancorporation, Inc (FCBN)",1/2/03,9/30/14,daily,12/8/14GOOG/PINK_ACNI,"American Community Newspapers, Inc. (ACNI)",8/2/05,10/27/14,daily,12/8/14GOOG/PINK_WFSC,Weststar Financial Services Corp (WFSC),1/2/03,5/12/14,daily,8/10/14GOOG/NASDAQ_MKTG,Responsys Inc (MKTG),4/21/11,2/6/14,daily,5/7/14GOOG/AMEX_RVR,White River Capital (RVR),1/19/07,2/14/13,daily,8/27/13GOOG/PINK_ASAM,Assuranceamerica Corp (ASAM),8/6/03,12/17/13,daily,3/16/14GOOG/PINK_FPFCQ,First Place Financial Corp. (FPFCQ),1/2/03,9/22/14,daily,12/8/14GOOG/NYSE_GRP,Granite Real Estate Inc (GRP),6/11/12,1/3/13,daily,8/27/13GOOG/PINK_CAGM,China Green Material Technologies Inc. (CAGM),2/24/11,4/20/11,daily,8/27/13GOOG/PINK_FCSC,Fibrocell Science Inc (FCSC),10/21/09,5/16/13,daily,8/27/13GOOG/PINK_SRTI,Sunrise Telecom Incorporated (SRTI),7/13/00,9/4/14,daily,12/3/14GOOG/AMEX_MBA,CIBT Education Group Inc (USA) (MBA),10/2/07,5/6/13,daily,12/10/13GOOG/PINK_FGMG,Florida Gaming Corporation (FGMG),2/3/03,8/5/14,daily,11/3/14GOOG/AMEX_WGA,Wells-Gardner Electronics Corporation (WGA),3/11/81,10/29/14,daily,12/8/14GOOG/PINK_SLGI,Bay Acquisition Corp (SLGI),5/20/05,11/10/14,daily,12/8/14GOOG/PINK_AXSI,"Axcess International, Inc. (AXSI)",1/2/03,9/11/13,daily,12/10/13GOOG/PINK_RNWF,"Renewal Fuels, Inc. (RNWF)",12/13/06,7/15/13,daily,10/13/13GOOG/NYSE_URS,URS Corp (URS),3/11/81,10/16/14,daily,12/8/14GOOG/AMEX_ATA,Safety First Trust Principal-Protected Certificates Linked to a U.S.-Europe-Japan Basket (ATA),2/26/08,3/5/14,daily,6/3/14GOOG/NASDAQ_ITMN,InterMune Inc (ITMN),3/24/00,9/26/14,daily,12/8/14GOOG/NASDAQ_FBMI,Firstbank Corporation (FBMI),1/3/00,5/30/14,daily,8/28/14GOOG/PINK_LAWEQ,Law Enforcem Assoc (LAWEQ),7/15/05,1/24/13,daily,8/27/13GOOG/PINK_NCLC,NORCAL COMMTY BCP CA (NCLC),1/2/03,12/4/13,daily,3/4/14GOOG/AMEX_SSE,Southern Connecticut Bancorp Inc. (SSE),7/31/01,6/21/13,daily,12/10/13GOOG/NASDAQ_VOXX,VOXX International Corp (VOXX),5/29/87,12/9/11,daily,12/10/13GOOG/NASDAQ_TRLG,"True Religion Apparel, Inc. (TRLG)",5/29/03,7/30/13,daily,12/10/13GOOG/PINK_OSGIQ,Overseas Shipholding Group Inc. (OSGIQ),1/2/03,6/3/14,daily,9/1/14GOOG/PINK_LWLL,Linkwell Corporation (LWLL),8/22/05,6/27/14,daily,9/25/14GOOG/PINK_PCXCQ,Patriot Coal Corporation (PCXCQ),6/11/12,12/17/13,daily,3/16/14GOOG/PINK_RIVE,Riverview Financial Corporation (RIVE),3/4/09,11/1/13,daily,12/7/13GOOG/NASDAQ_ASIA,Asiainfo-Linkage Inc (ASIA),1/3/00,1/15/14,daily,4/15/14GOOG/NASDAQ_RTLX,Retalix Limited (RTLX),7/10/98,2/5/13,daily,12/10/13GOOG/PINK_TEXG,Terax Energy Inc. (TEXG),6/13/05,8/26/13,daily,11/24/13GOOG/NYSE_HNZ,H.J. Heinz Company (HNZ),3/11/81,6/7/13,daily,12/10/13GOOG/PINK_CPCF,"CPC of America, Inc. (CPCF)",2/22/11,5/11/11,daily,8/27/13GOOG/PINK_SBKCQ,Security Bank Corporation (SBKCQ),6/3/03,8/5/14,daily,11/3/14GOOG/PINK_DINIQ,Decorator Industries Inc. (DINIQ),1/2/03,10/15/12,daily,8/27/13GOOG/PINK_IREP,"Interep National Radio Sales, Inc. (IREP)",2/10/06,1/24/14,daily,4/24/14GOOG/NASDAQ_STSA,Sterling Financial Corporation (STSA),11/21/91,4/17/14,daily,7/16/14GOOG/PINK_NBFAQ,NOVA BIOSOURCE FUELS (NBFAQ),4/15/09,9/15/14,daily,12/8/14GOOG/PINK_IVVI,"Montvale Technologies, Inc. (IVVI)",6/23/09,7/30/13,daily,10/28/13GOOG/PINK_TVOC,Texas Vanguard Oil Co (TVOC),1/2/03,10/20/14,daily,12/8/14GOOG/AMEX_GOK,Geokinetics (GOK),1/3/00,12/14/12,daily,8/27/13GOOG/NYSE_SRZ,Sunrise Senior Living (SRZ),3/7/97,1/8/13,daily,8/27/13GOOG/PINK_ADZR,Adzone Research Inc (ADZR),7/21/06,3/28/13,daily,8/27/13GOOG/PINK_AADI,American Asset Development Inc (AADI),6/27/06,8/27/13,daily,11/25/13GOOG/PINK_IASCA,"IAS Energy, Inc. (IASCA)",1/2/03,1/24/13,daily,8/27/13GOOG/NYSE_GWAY,"Greenway Medical Technologies, Inc. (GWAY)",2/2/12,11/4/13,daily,2/2/14GOOG/NASDAQ_PCBC,Pacific Capital Bancorp (PCBC),5/13/96,11/30/12,daily,12/10/13GOOG/NASDAQ_JFBI,Jefferson Bancshares Inc (JFBI),7/2/03,5/30/14,daily,8/28/14GOOG/NYSE_AGP,Amerigroup Corp. (AGP),11/6/01,12/21/12,daily,8/27/13GOOG/NYSE_OMX,OfficeMax Inc (OMX),3/11/81,11/5/13,daily,2/3/14GOOG/PINK_CKFB,C K F Bancorp Inc (CKFB),1/2/03,11/14/12,daily,8/27/13GOOG/PINK_TRDM,Trend Mining Company (TRDM),6/19/00,1/17/13,daily,8/27/13GOOG/NYSE_RBN,Robbins & Myers (RBN),4/21/97,2/20/13,daily,8/27/13GOOG/PINK_ZCOM,"Impreso, Inc. (ZCOM)",9/5/06,8/22/14,daily,11/20/14GOOG/NASDAQ_HTCO,Hickory Tech Corporation (HTCO),3/23/95,10/16/14,daily,12/8/14GOOG/NASDAQ_LSBI,LSB Financial Corp. (LSBI),2/3/95,10/31/14,daily,12/8/14GOOG/PINK_VRYAF,ViryaNet Ltd. (VRYAF),9/19/00,8/27/14,daily,11/25/14GOOG/NASDAQ_MEAS,"Measurement Specialties, Inc. (MEAS)",4/23/93,10/9/14,daily,12/8/14GOOG/NASDAQ_OTT,Otelco Inc (OTT),12/16/04,5/24/13,daily,12/10/13GOOG/NYSE_USU,USEC Inc. (USU),7/23/98,9/29/14,daily,12/7/14GOOG/NASDAQ_COBR,Cobra Electronics Corporation (COBR),3/11/81,10/8/14,daily,12/8/14GOOG/NYSE_BZ,Boise Inc. (BZ),6/28/07,10/25/13,daily,1/23/14GOOG/NYSE_SAI,Leidos Holdings Inc (SAI),10/13/06,9/27/13,daily,12/13/13GOOG/PINK_VISI,"Volt Information Sciences, Inc. (VISI)",1/2/03,8/25/14,daily,11/23/14GOOG/NASDAQ_DELL,Dell Inc. (DELL),6/22/88,10/29/13,daily,1/27/14GOOG/PINK_GHII,Gold Horse International Inc (GHII),8/2/07,8/14/14,daily,11/12/14GOOG/PINK_ABNS,Alliance Bancshares California (ABNS),6/17/09,7/3/12,daily,8/27/13GOOG/PINK_GEPT,"Global EPoint, Inc. (GEPT)",1/4/99,8/6/13,daily,11/5/13GOOG/NASDAQ_STEI,"Stewart Enterprises, Inc. (STEI)",10/10/91,12/23/13,daily,3/23/14GOOG/PINK_BKRSQ,Bakers Footwear Group Inc (BKRSQ),6/11/12,9/29/14,daily,12/8/14GOOG/PINK_FPCG,First Physicians Capital Group Inc (FPCG),12/30/05,10/23/14,daily,12/7/14GOOG/NASDAQ_FIRE,Sourcefire LLC (FIRE),3/9/07,10/7/13,daily,1/5/14GOOG/NASDAQ_MNTG,"MTR Gaming Group, Inc. (MNTG)",12/7/92,9/18/14,daily,12/8/14GOOG/PINK_SKFBQ,S K Famous Brands (SKFBQ),1/2/03,10/15/13,daily,1/13/14GOOG/PINK_BCST,"Broadcast International, Inc. (BCST)",1/23/04,8/4/14,daily,11/2/14GOOG/PINK_LJPC,La Jolla Pharmaceutical Company (LJPC),1/2/03,4/2/13,daily,8/27/13GOOG/PINK_JGBO,Jiangbo Pharmaceuticals Inc (JGBO),1/2/03,7/1/13,daily,9/29/13GOOG/NASDAQ_OCZ,OCZ Technology Group Inc. (OCZ),4/23/10,8/22/14,daily,11/20/14GOOG/NASDAQ_SLTM,Solta Medical Inc (SLTM),11/10/06,1/23/14,daily,4/23/14GOOG/NASDAQ_CHDX,"Chindex International, Inc. (CHDX)",8/18/94,9/29/14,daily,12/8/14GOOG/NASDAQ_WBCO,Washington Banking Co (WBCO),6/23/98,4/30/14,daily,7/29/14GOOG/PINK_ASFN,Atlantic Southern Financial Grou (ASFN),4/16/07,2/28/13,daily,8/27/13GOOG/PINK_CWLZ,Cowlitz Bancorporation (CWLZ),1/2/03,8/12/14,daily,11/10/14GOOG/AMEX_PDO,Pyramid Oil Company (PDO),1/14/00,9/10/14,daily,12/8/14GOOG/NASDAQ_IMCB,Intermountain Community Bancorp (IMCB),7/17/00,10/31/14,daily,12/8/14GOOG/NASDAQ_OBAF,OBA Financial Services Inc (OBAF),1/22/10,9/19/14,daily,12/8/14GOOG/NASDAQ_VSNT,Versant Corp (VSNT),7/18/96,12/20/12,daily,12/10/13GOOG/NYSE_PVR,PVR Partners LP (PVR),10/25/01,3/20/14,daily,6/18/14GOOG/PINK_DYMTF,Dynamotive Energy Sy (DYMTF),8/10/10,10/23/12,daily,8/27/13GOOG/NASDAQ_TAYC,Taylor Capital Group Inc (TAYC),10/16/02,8/15/14,daily,11/13/14GOOG/PINK_PWON,Powin Corporation (PWON),9/30/10,9/3/14,daily,12/1/14GOOG/NASDAQ_OPNT,"OPNET Technologies, Inc. (OPNT)",8/2/00,12/18/12,daily,12/10/13GOOG/PINK_TLLE,"Teletouch Communications, Inc. (TLLE)",1/2/03,8/6/13,daily,11/4/13GOOG/NYSE_GMXR,GMX Resources Inc. (GMXR),12/16/09,3/28/13,daily,12/10/13GOOG/NASDAQ_XRTX,Xyratex Ltd. (XRTX),6/24/04,3/31/14,daily,6/29/14GOOG/PINK_ATYG,"Atlas Technology Group, Inc. (ATYG)",9/7/05,10/2/14,daily,12/8/14GOOG/PINK_CMKG,"Mktg, Inc. (CMKG)",6/25/10,12/5/12,daily,8/27/13GOOG/PINK_MSEL,"Merisel, Inc. (MSEL)",1/4/99,8/27/13,daily,11/25/13GOOG/NYSE_ADY,Feihe International Inc (ADY),5/14/03,6/27/13,daily,12/10/13GOOG/PINK_ROHI,Rotech Healthcare Inc. (ROHI),11/8/05,9/26/13,daily,12/13/13GOOG/PINK_SGLN,SurgLine International Inc (SGLN),4/19/12,10/9/14,daily,12/8/14GOOG/NASDAQ_XRSC,XRS Corp (XRSC),1/3/03,10/31/14,daily,12/8/14GOOG/NASDAQ_MCRS,"MICROS Systems, Inc. (MCRS)",3/11/81,9/8/14,daily,12/7/14GOOG/PINK_MZIAQ,Milacron Inc (MZIAQ),1/2/03,2/15/13,daily,8/27/13GOOG/NASDAQ_WBSN,Websense Inc (WBSN),3/28/00,6/25/13,daily,12/10/13GOOG/PINK_ARIS,"ARI Network Services, Inc. (ARIS)",4/9/96,3/4/13,daily,8/27/13GOOG/PINK_TRNT,TransNet Corporation (TRNT),1/2/03,5/13/13,daily,8/27/13GOOG/NASDAQ_BANC,Banc of California Inc (BANC),8/23/02,5/28/14,daily,8/26/14GOOG/NYSE_ZLC,Zale Corporation (ZLC),8/2/93,5/29/14,daily,8/27/14GOOG/PINK_GBLE,Global 8 Environmental Technologies Inc (GBLE),5/15/08,9/19/13,daily,12/13/13GOOG/PINK_ITYCQ,Integrity Bancshares Inc. (ITYCQ),9/6/06,4/5/13,daily,8/27/13GOOG/PINK_IDAI,Idna Inc. (IDAI),3/8/06,12/14/12,daily,8/27/13GOOG/NASDAQ_FFEX,"Frozen Food Express Industries, Inc. (FFEX)",3/11/81,8/19/13,daily,12/10/13GOOG/PINK_EFOI,Energy Focus Inc (EFOI),1/3/11,1/14/13,daily,8/27/13GOOG/PINK_EDVC,Endevco Inc (EDVC),10/9/03,2/26/13,daily,8/27/13GOOG/NASDAQ_ONXX,"Onyx Pharmaceuticals, Inc. (ONXX)",5/9/96,9/30/13,daily,12/27/13GOOG/PINK_ELCO,"Elcom International, Inc. (ELCO)",1/4/99,8/8/13,daily,11/5/13GOOG/PINK_KVPBQ,KV Pharmaceutical Co (KVPBQ),6/11/12,9/13/13,daily,12/12/13GOOG/PINK_PRTKQ,"Profile Technologies, Inc. (PRTKQ)",1/2/03,12/20/13,daily,3/20/14GOOG/NASDAQ_MDTH,MedCath Corporation (MDTH),7/24/01,9/21/12,daily,12/10/13GOOG/NASDAQ_CPNO,"Copano Energy, L.L.C. (CPNO)",11/9/04,4/30/13,daily,12/10/13GOOG/PINK_WGNB,WGNB Corp. (WGNB),1/2/03,4/2/14,daily,7/1/14GOOG/AMEX_GSX,Gasco Energy Inc (GSX),1/6/00,6/30/14,daily,9/30/14GOOG/PINK_UPHN,Uphonia Inc. (UPHN),5/24/06,8/23/13,daily,11/21/13GOOG/PINK_AUTCF,AutoChina International Limited (AUTCF),2/13/12,2/24/12,daily,8/27/13GOOG/NYSE_TXI,"Texas Industries, Inc. (TXI)",3/11/81,7/1/14,daily,9/30/14GOOG/NASDAQ_HOGS,ZHONGPIN INC. (HOGS),1/12/05,6/26/13,daily,10/15/13GOOG/NYSE_WPO,Graham Holdings Co (WPO),3/11/81,11/27/13,daily,1/6/14GOOG/NASDAQ_TELK,"Telik, Inc. (TELK)",8/11/00,9/9/14,daily,10/8/14GOOG/NASDAQ_ASTX,"Astex Pharmaceuticals, Inc. (ASTX)",1/2/03,10/10/13,daily,1/8/14GOOG/NYSE_PXP,Plains Exploration &amp; Production Company (PXP),12/18/02,5/30/13,daily,12/10/13GOOG/NASDAQ_MMUS,"MakeMusic, Inc. (MMUS)",6/29/95,4/30/13,daily,12/10/13GOOG/NASDAQ_CRBC,Citizens Republic Bancorp Inc (CRBC),5/30/85,4/12/13,daily,12/10/13GOOG/NYSE_ELN,"Elan Corporation, plc (ADR) (ELN)",1/19/82,12/18/13,daily,3/18/14GOOG/NYSE_RAH,Ralcorp Holdings (RAH),3/31/97,1/29/13,daily,8/27/13GOOG/NASDAQ_ENDP,Endo Health Solutions Inc (ENDP),7/18/00,2/28/14,daily,5/29/14GOOG/PINK_APDTQ,Alphatrade.Com (APDTQ),1/2/03,1/4/13,daily,8/27/13GOOG/NYSE_PDH,PetroLogistics LP (PDH),5/4/12,7/15/14,daily,10/13/14GOOG/PINK_GRBEQ,Grubb &amp; Ellis Company (GRBEQ),3/15/13,4/15/13,daily,8/27/13GOOG/NASDAQ_VMED,Virgin Media Inc. (VMED),1/13/03,6/7/13,daily,12/10/13GOOG/NASDAQ_SOMX,Pernix Sleep Inc (SOMX),12/15/05,3/6/13,daily,12/10/13